tcpdump -n -i eth0
tcpdump: verbose output suppressed, use -v or -vv for full protocol decode
listening on eth0, link-type EN10MB (Ethernet), capture size 262144 bytes
00:13:03.035496 IP 134.122.43.237.22 > 99.231.86.245.52751: Flags [P.], seq 3224857145:3224857181, ack 965383683, win 501, options [nop,nop,TS val 288109989 ecr 2169893404], length 36
00:13:03.036593 IP 134.122.43.237.22 > 99.231.86.245.52751: Flags [P.], seq 36:144, ack 1, win 501, options [nop,nop,TS val 288109990 ecr 2169893404], length 108
00:13:03.036644 IP 134.122.43.237.22 > 99.231.86.245.52751: Flags [P.], seq 144:180, ack 1, win 501, options [nop,nop,TS val 288109990 ecr 2169893404], length 36
00:13:03.036685 IP 134.122.43.237.22 > 99.231.86.245.52751: Flags [P.], seq 180:288, ack 1, win 501, options [nop,nop,TS val 288109990 ecr 2169893404], length 108
00:13:03.036716 IP 134.122.43.237.22 > 99.231.86.245.52751: Flags [P.], seq 288:324, ack 1, win 501, options [nop,nop,TS val 288109990 ecr 2169893404], length 36
00:13:03.036853 IP 134.122.43.237.22 > 99.231.86.245.52751: Flags [P.], seq 324:544, ack 1, win 501, options [nop,nop,TS val 288109990 ecr 2169893404], length 220
00:13:03.036890 IP 134.122.43.237.22 > 99.231.86.245.52751: Flags [P.], seq 544:580, ack 1, win 501, options [nop,nop,TS val 288109990 ecr 2169893404], length 36
00:13:03.036929 IP 134.122.43.237.22 > 99.231.86.245.52751: Flags [P.], seq 580:776, ack 1, win 501, options [nop,nop,TS val 288109990 ecr 2169893404], length 196
00:13:03.036967 IP 134.122.43.237.22 > 99.231.86.245.52751: Flags [P.], seq 776:812, ack 1, win 501, options [nop,nop,TS val 288109990 ecr 2169893404], length 36
00:13:03.037009 IP 134.122.43.237.22 > 99.231.86.245.52751: Flags [P.], seq 812:1008, ack 1, win 501, options [nop,nop,TS val 288109990 ecr 2169893404], length 196
00:13:03.050909 IP 99.231.86.245.52751 > 134.122.43.237.22: Flags [.], ack 36, win 21957, options [nop,nop,TS val 2169893422 ecr 288109989], length 0
00:13:03.050910 IP 99.231.86.245.52751 > 134.122.43.237.22: Flags [.], ack 144, win 21956, options [nop,nop,TS val 2169893423 ecr 288109990], length 0
00:13:03.050910 IP 99.231.86.245.52751 > 134.122.43.237.22: Flags [.], ack 812, win 21957, options [nop,nop,TS val 2169893425 ecr 288109990], length 0
00:13:03.050962 IP 134.122.43.237.22 > 99.231.86.245.52751: Flags [P.], seq 1008:2676, ack 1, win 501, options [nop,nop,TS val 288110004 ecr 2169893422], length 1668
00:13:03.051125 IP 134.122.43.237.22 > 99.231.86.245.52751: Flags [P.], seq 2676:2864, ack 1, win 501, options [nop,nop,TS val 288110004 ecr 2169893425], length 188
00:13:03.051189 IP 134.122.43.237.22 > 99.231.86.245.52751: Flags [P.], seq 2864:2900, ack 1, win 501, options [nop,nop,TS val 288110004 ecr 2169893425], length 36
00:13:03.051233 IP 134.122.43.237.22 > 99.231.86.245.52751: Flags [P.], seq 2900:3088, ack 1, win 501, options [nop,nop,TS val 288110005 ecr 2169893425], length 188
00:13:03.051271 IP 134.122.43.237.22 > 99.231.86.245.52751: Flags [P.], seq 3088:3124, ack 1, win 501, options [nop,nop,TS val 288110005 ecr 2169893425], length 36
00:13:03.051315 IP 134.122.43.237.22 > 99.231.86.245.52751: Flags [P.], seq 3124:3312, ack 1, win 501, options [nop,nop,TS val 288110005 ecr 2169893425], length 188
00:13:03.051365 IP 134.122.43.237.22 > 99.231.86.245.52751: Flags [P.], seq 3312:3348, ack 1, win 501, options [nop,nop,TS val 288110005 ecr 2169893425], length 36
00:13:03.051430 IP 134.122.43.237.22 > 99.231.86.245.52751: Flags [P.], seq 3348:3552, ack 1, win 501, options [nop,nop,TS val 288110005 ecr 2169893425], length 204
00:13:03.051465 IP 134.122.43.237.22 > 99.231.86.245.52751: Flags [P.], seq 3552:3588, ack 1, win 501, options [nop,nop,TS val 288110005 ecr 2169893425], length 36
00:13:03.051507 IP 134.122.43.237.22 > 99.231.86.245.52751: Flags [P.], seq 3588:3792, ack 1, win 501, options [nop,nop,TS val 288110005 ecr 2169893425], length 204
00:13:03.051543 IP 134.122.43.237.22 > 99.231.86.245.52751: Flags [P.], seq 3792:3828, ack 1, win 501, options [nop,nop,TS val 288110005 ecr 2169893425], length 36
00:13:03.051580 IP 134.122.43.237.22 > 99.231.86.245.52751: Flags [P.], seq 3828:4032, ack 1, win 501, options [nop,nop,TS val 288110005 ecr 2169893425], length 204
00:13:03.051611 IP 134.122.43.237.22 > 99.231.86.245.52751: Flags [P.], seq 4032:4068, ack 1, win 501, options [nop,nop,TS val 288110005 ecr 2169893425], length 36
00:13:03.051670 IP 134.122.43.237.22 > 99.231.86.245.52751: Flags [P.], seq 4068:4272, ack 1, win 501, options [nop,nop,TS val 288110005 ecr 2169893425], length 204
00:13:03.051704 IP 134.122.43.237.22 > 99.231.86.245.52751: Flags [P.], seq 4272:4308, ack 1, win 501, options [nop,nop,TS val 288110005 ecr 2169893425], length 36
00:13:03.051769 IP 134.122.43.237.22 > 99.231.86.245.52751: Flags [P.], seq 4308:4512, ack 1, win 501, options [nop,nop,TS val 288110005 ecr 2169893425], length 204
00:13:03.051827 IP 134.122.43.237.22 > 99.231.86.245.52751: Flags [P.], seq 4512:4548, ack 1, win 501, options [nop,nop,TS val 288110005 ecr 2169893425], length 36
00:13:03.058101 IP 99.231.86.245.52751 > 134.122.43.237.22: Flags [.], ack 1008, win 21954, options [nop,nop,TS val 2169893426 ecr 288109990], length 0
00:13:03.058158 IP 134.122.43.237.22 > 99.231.86.245.52751: Flags [P.], seq 4548:7428, ack 1, win 501, options [nop,nop,TS val 288110011 ecr 2169893426], length 2880
00:13:03.066775 IP 99.231.86.245.52751 > 134.122.43.237.22: Flags [.], ack 4512, win 21947, options [nop,nop,TS val 2169893435 ecr 288110005], length 0
00:13:03.066775 IP 99.231.86.245.52751 > 134.122.43.237.22: Flags [.], ack 4548, win 21946, options [nop,nop,TS val 2169893435 ecr 288110005], length 0
00:13:03.066835 IP 134.122.43.237.22 > 99.231.86.245.52751: Flags [P.], seq 7428:7892, ack 1, win 501, options [nop,nop,TS val 288110020 ecr 2169893435], length 464
00:13:03.066990 IP 134.122.43.237.22 > 99.231.86.245.52751: Flags [P.], seq 7892:8080, ack 1, win 501, options [nop,nop,TS val 288110020 ecr 2169893435], length 188
00:13:03.067035 IP 134.122.43.237.22 > 99.231.86.245.52751: Flags [P.], seq 8080:8116, ack 1, win 501, options [nop,nop,TS val 288110020 ecr 2169893435], length 36
00:13:03.067097 IP 134.122.43.237.22 > 99.231.86.245.52751: Flags [P.], seq 8116:8304, ack 1, win 501, options [nop,nop,TS val 288110020 ecr 2169893435], length 188
00:13:03.067150 IP 134.122.43.237.22 > 99.231.86.245.52751: Flags [P.], seq 8304:8340, ack 1, win 501, options [nop,nop,TS val 288110020 ecr 2169893435], length 36
00:13:03.067211 IP 134.122.43.237.22 > 99.231.86.245.52751: Flags [P.], seq 8340:8544, ack 1, win 501, options [nop,nop,TS val 288110021 ecr 2169893435], length 204
00:13:03.067273 IP 134.122.43.237.22 > 99.231.86.245.52751: Flags [P.], seq 8544:8580, ack 1, win 501, options [nop,nop,TS val 288110021 ecr 2169893435], length 36
6939 packets captured
6950 packets received by filter
10 packets dropped by kernel