tcpdump -c 5 -i eth0
tcpdump: verbose output suppressed, use -v or -vv for full protocol decode
listening on eth0, link-type EN10MB (Ethernet), capture size 262144 bytes
23:48:53.162980 IP 134.122.43.237.ssh > cpe9050cab0d503-cm9050cab0d500.cpe.net.cable.rogers.com.52751: Flags [P.], seq 3200276973:3200277009, ack 965367223, win 501, options [nop,nop,TS val 286660116 ecr 2168456395], length 36
23:48:53.163401 IP 134.122.43.237.ssh > cpe9050cab0d503-cm9050cab0d500.cpe.net.cable.rogers.com.52751: Flags [P.], seq 36:144, ack 1, win 501, options [nop,nop,TS val 286660117 ecr 2168456395], length 108
23:48:53.163443 IP 134.122.43.237.ssh > cpe9050cab0d503-cm9050cab0d500.cpe.net.cable.rogers.com.52751: Flags [P.], seq 144:180, ack 1, win 501, options [nop,nop,TS val 286660117 ecr 2168456395], length 36
23:48:53.163477 IP 134.122.43.237.ssh > cpe9050cab0d503-cm9050cab0d500.cpe.net.cable.rogers.com.52751: Flags [P.], seq 180:288, ack 1, win 501, options [nop,nop,TS val 286660117 ecr 2168456395], length 108
23:48:53.163504 IP 134.122.43.237.ssh > cpe9050cab0d503-cm9050cab0d500.cpe.net.cable.rogers.com.52751: Flags [P.], seq 288:324, ack 1, win 501, options [nop,nop,TS val 286660117 ecr 2168456395], length 36
5 packets captured
21 packets received by filter
0 packets dropped by kernel
